{
  "schema": "io.navocms.cloudflare-staging-binding.v3",
  "tenantId": "11111111-1111-4111-8111-111111111111",
  "siteId": "22222222-2222-4222-8222-222222222222",
  "environment": "staging",
  "cloudflare": {
    "accountId": "staging-account",
    "projectId": "staging-pages",
    "productionBranch": "staging",
    "previewBranch": "preview",
    "previewHostnameSuffix": ".pages.dev",
    "allowedHostname": "staging.example.test",
    "tokenSecretRef": "secret:delivery/cloudflare-token"
  }
}
